[
  {
    "id": "buffetsgourmet_winningclub",
    "summary": {
      "description": "",
      "rules": [
      ]
    },
    "howToRun": [
    ],
    "examples": [
    ],
    "tipsAndTricks": [
    ],
    "opposingTips": [
    ]
  },
  {
    "id": "hero_winningclub",
    "summary": {
      "description": "",
      "rules": [
      ]
    },
    "howToRun": [
    ],
    "examples": [
    ],
    "tipsAndTricks": [
    ],
    "opposingTips": [
    ]
  },
  {
    "id": "suitor_winningclub",
    "summary": {
      "description": "",
      "rules": [
      ]
    },
    "howToRun": [
    ],
    "examples": [
    ],
    "tipsAndTricks": [
    ],
    "opposingTips": [
    ]
  },
  {
    "id": "racketeer_winningclub",
    "summary": {
      "description": "",
      "rules": [
      ]
    },
    "howToRun": [
    ],
    "examples": [
    ],
    "tipsAndTricks": [
    ],
    "opposingTips": [
    ]
  },
  {
    "id": "dullahan_winningclub",
    "summary": {
      "description": "",
      "rules": [
      ]
    },
    "howToRun": [
    ],
    "examples": [
    ],
    "tipsAndTricks": [
    ],
    "opposingTips": [
    ]
  },
  {
    "id": "sinofgluttony_winningclub",
    "summary": {
      "description": "",
      "rules": [
      ]
    },
    "howToRun": [
    ],
    "examples": [
    ],
    "tipsAndTricks": [
    ],
    "opposingTips": [
    ]
  }
]
