[
  {
    "id": "advisor",
    "summary": {
      "description": "",
      "rules": [
      ]
    },
    "howToRun": [
    ],
    "examples": [
    ],
    "tipsAndTricks": [
    ],
    "opposingTips": [
    ]
  },
  {
    "id": "corpseeater",
    "summary": {
      "description": "",
      "rules": [
      ]
    },
    "howToRun": [
    ],
    "examples": [
    ],
    "tipsAndTricks": [
    ],
    "opposingTips": [
    ]
  },
  {
    "id": "sol",
    "summary": {
      "description": "",
      "rules": [
      ]
    },
    "howToRun": [
    ],
    "examples": [
    ],
    "tipsAndTricks": [
    ],
    "opposingTips": [
    ]
  },
  {
    "id": "trainconductor",
    "summary": {
      "description": "",
      "rules": [
      ]
    },
    "howToRun": [
    ],
    "examples": [
    ],
    "tipsAndTricks": [
    ],
    "opposingTips": [
    ]
  },
  {
    "id": "vengeance",
    "summary": {
      "description": "",
      "rules": [
      ]
    },
    "howToRun": [
    ],
    "examples": [
    ],
    "tipsAndTricks": [
    ],
    "opposingTips": [
    ]
  },
  {
    "id": "veteran",
    "summary": {
      "description": "",
      "rules": [
      ]
    },
    "howToRun": [
    ],
    "examples": [
    ],
    "tipsAndTricks": [
    ],
    "opposingTips": [
    ]
  }
]
