[
  {
    "id": "eavesdropper_winningclub",
    "summary": {
      "description": "",
      "rules": [
      ]
    },
    "howToRun": [
    ],
    "examples": [
    ],
    "tipsAndTricks": [
    ],
    "opposingTips": [
    ]
  },
  {
    "id": "journalist_winningclub",
    "summary": {
      "description": "",
      "rules": [
      ]
    },
    "howToRun": [
    ],
    "examples": [
    ],
    "tipsAndTricks": [
    ],
    "opposingTips": [
    ]
  },
  {
    "id": "lisarinna_winningclub",
    "summary": {
      "description": "",
      "rules": [
      ]
    },
    "howToRun": [
    ],
    "examples": [
    ],
    "tipsAndTricks": [
    ],
    "opposingTips": [
    ]
  },
  {
    "id": "copycat_winningclub",
    "summary": {
      "description": "",
      "rules": [
      ]
    },
    "howToRun": [
    ],
    "examples": [
    ],
    "tipsAndTricks": [
    ],
    "opposingTips": [
    ]
  },
  {
    "id": "realtor_winningclub",
    "summary": {
      "description": "",
      "rules": [
      ]
    },
    "howToRun": [
    ],
    "examples": [
    ],
    "tipsAndTricks": [
    ],
    "opposingTips": [
    ]
  },
  {
    "id": "potionseller_winningclub",
    "summary": {
      "description": "",
      "rules": [
      ]
    },
    "howToRun": [
    ],
    "examples": [
    ],
    "tipsAndTricks": [
    ],
    "opposingTips": [
    ]
  }
]
